{
  "schema_version": "source-metadata-v1",
  "source_id": "tradecraft-primer-6ec9d9fb",
  "title": "tradecraft-primer",
  "author": null,
  "year": null,
  "source_type": "markdown",
  "file_type": "md",
  "original_filename": "source.md",
  "original_url": null,
  "sha256": "6ec9d9fb28d64e379011c244e9853d8f7816e1d5e96477731be494d0993328a7",
  "file_size_bytes": 91182,
  "authority": "secondary",
  "rights_status": "distillation-only",
  "volatility": "low",
  "review_cadence": "annual",
  "conversion_status": "ok",
  "converter_used": null,
  "converter_warnings": [],
  "page_count": null,
  "word_count": 13162,
  "anchor_count": 3,
  "asset_count": null,
  "ingested_at": "2026-07-10T11:13:33.181851+00:00",
  "notes": null
}
