{
  "schema_version": "source-metadata-v1",
  "source_id": "mcp-spec-overview-37bf1590",
  "title": "mcp-spec-overview",
  "author": null,
  "year": null,
  "source_type": "markdown",
  "file_type": "md",
  "original_filename": "source.md",
  "original_url": null,
  "sha256": "37bf1590e3e51df1f06b64c8cc80683cec309305fca4fbe7a4a4146231c3eb8f",
  "file_size_bytes": 5542,
  "authority": "secondary",
  "rights_status": "open",
  "volatility": "low",
  "review_cadence": "annual",
  "conversion_status": "ok",
  "converter_used": null,
  "converter_warnings": [],
  "page_count": null,
  "word_count": 691,
  "anchor_count": 1,
  "asset_count": null,
  "ingested_at": "2026-07-05T07:16:34.080739+00:00",
  "notes": null
}