{
  "schema_version": "source-metadata-v1",
  "source_id": "simonwillison-lethal-867e7bf9",
  "title": "simonwillison-lethal-trifecta",
  "author": null,
  "year": null,
  "source_type": "markdown",
  "file_type": "md",
  "original_filename": "source.md",
  "original_url": null,
  "sha256": "867e7bf944facbe4aa614d4aca7a092f185443cb353540d4d861afe668a65e2d",
  "file_size_bytes": 9785,
  "authority": "secondary",
  "rights_status": "distillation-only",
  "volatility": "low",
  "review_cadence": "annual",
  "conversion_status": "ok",
  "converter_used": null,
  "converter_warnings": [],
  "page_count": null,
  "word_count": 1299,
  "anchor_count": 1,
  "asset_count": null,
  "ingested_at": "2026-07-05T07:23:29.971093+00:00",
  "notes": null
}