{
  "schema_version": "source-metadata-v1",
  "source_id": "alex-petrov-database-7bf3da04",
  "title": "Original",
  "author": null,
  "year": null,
  "source_type": "markdown",
  "file_type": "markdown",
  "original_filename": "original.md",
  "original_url": null,
  "sha256": "7bf3da04ec81fe3474bcbcb65fce340bb03801949521e140f5dd8b44b6c74b4f",
  "file_size_bytes": 800314,
  "authority": "secondary",
  "rights_status": "distillation-only",
  "volatility": "low",
  "review_cadence": "annual",
  "conversion_status": "ok",
  "converter_used": "cache",
  "converter_warnings": [],
  "page_count": null,
  "word_count": null,
  "anchor_count": 578,
  "asset_count": 0,
  "ingested_at": "2026-06-21T21:57:39.514539+00:00",
  "notes": null
}