{
  "schema_version": "source-metadata-v1",
  "source_id": "agarwal-bain-powerfu-5b75ae90",
  "title": "agarwal-bain-powerful-teaching",
  "author": null,
  "year": null,
  "source_type": "markdown",
  "file_type": "md",
  "original_filename": "source.md",
  "original_url": null,
  "sha256": "5b75ae903fcd8581acdf745b5b1ce5744ebe0e69d74d42d861ae0c4e042e0432",
  "file_size_bytes": 541809,
  "authority": "secondary",
  "rights_status": "distillation-only",
  "volatility": "low",
  "review_cadence": "annual",
  "conversion_status": "ok",
  "converter_used": null,
  "converter_warnings": [],
  "page_count": null,
  "word_count": 82775,
  "anchor_count": 18,
  "asset_count": null,
  "ingested_at": "2026-07-26T10:28:14.916159+00:00",
  "notes": null
}
