{
  "schema_version": "source-metadata-v1",
  "source_id": "improving-skill-crea-f86a022e",
  "title": "improving-skill-creator-test-measure-and-refine-agent-skills",
  "author": null,
  "year": null,
  "source_type": "markdown",
  "file_type": "md",
  "original_filename": "source.md",
  "original_url": null,
  "sha256": "f86a022e76ca48af7b04f2bafce7c1dc0e93f6edd9c3079a0317258f25724515",
  "file_size_bytes": 6366,
  "authority": "secondary",
  "rights_status": "distillation-only",
  "volatility": "low",
  "review_cadence": "annual",
  "conversion_status": "ok",
  "converter_used": null,
  "converter_warnings": [],
  "page_count": null,
  "word_count": 853,
  "anchor_count": 1,
  "asset_count": null,
  "ingested_at": "2026-07-25T09:58:35.984703+00:00",
  "notes": null
}