{
  "schema_version": "source-metadata-v1",
  "source_id": "vendor-workos-mcp-oa-0d5e0b52",
  "title": "vendor-workos-mcp-oauth-authorization",
  "author": null,
  "year": null,
  "source_type": "markdown",
  "file_type": "md",
  "original_filename": "source.md",
  "original_url": null,
  "sha256": "0d5e0b52d96a80f4d901918e435d7dfc0dd188321fc3e4cbcaee5b035b0473dd",
  "file_size_bytes": 11749,
  "authority": "secondary",
  "rights_status": "distillation-only",
  "volatility": "low",
  "review_cadence": "annual",
  "conversion_status": "ok",
  "converter_used": null,
  "converter_warnings": [],
  "page_count": null,
  "word_count": 1687,
  "anchor_count": 1,
  "asset_count": null,
  "ingested_at": "2026-07-05T07:23:29.969111+00:00",
  "notes": null
}