{
  "schema_version": "source-metadata-v1",
  "source_id": "mcp-spec-server-tool-8ed43301",
  "title": "mcp-spec-server-tools",
  "author": null,
  "year": null,
  "source_type": "markdown",
  "file_type": "md",
  "original_filename": "source.md",
  "original_url": null,
  "sha256": "8ed43301d44f1b15317963b8553eb025c3bd72f433ee873565338e727b106b55",
  "file_size_bytes": 13906,
  "authority": "secondary",
  "rights_status": "open",
  "volatility": "low",
  "review_cadence": "annual",
  "conversion_status": "ok",
  "converter_used": null,
  "converter_warnings": [],
  "page_count": null,
  "word_count": 1685,
  "anchor_count": 1,
  "asset_count": null,
  "ingested_at": "2026-07-05T07:16:34.084799+00:00",
  "notes": null
}