{
  "schema_version": "source-metadata-v1",
  "source_id": "craft-of-research-4e-14900d77",
  "title": "craft-of-research-4e",
  "author": null,
  "year": null,
  "source_type": "markdown",
  "file_type": "md",
  "original_filename": "source.md",
  "original_url": null,
  "sha256": "14900d779c9cb2949b551f0cf7d2d0317ad82054fd7b729e7dfbcbc474ba6e9c",
  "file_size_bytes": 564050,
  "authority": "secondary",
  "rights_status": "distillation-only",
  "volatility": "low",
  "review_cadence": "annual",
  "conversion_status": "ok",
  "converter_used": null,
  "converter_warnings": [],
  "page_count": null,
  "word_count": 91976,
  "anchor_count": 19,
  "asset_count": null,
  "ingested_at": "2026-07-24T22:10:59.223686+00:00",
  "notes": null
}
