{
  "schema_version": "source-metadata-v1",
  "source_id": "scalable-internet-ar-a6c7e769",
  "title": "Scalable Internet Architectures",
  "author": "Theo Schlossnagle",
  "year": 2006,
  "source_type": "markdown",
  "file_type": "markdown",
  "original_filename": "scalable-architectures.md",
  "original_url": null,
  "sha256": "a6c7e769c07281de15399e2fa33a2d3ceaf1edfcc47eae4aa74e29d7d41b487f",
  "file_size_bytes": 749981,
  "authority": "secondary",
  "rights_status": "distillation-only",
  "volatility": "low",
  "review_cadence": "annual",
  "conversion_status": "ok",
  "converter_used": "markdown",
  "converter_warnings": [],
  "page_count": null,
  "word_count": null,
  "anchor_count": 25,
  "asset_count": 0,
  "ingested_at": "2026-06-27T00:00:00+00:00",
  "notes": "Re-ingested by map-reduce build (markdown-cache); source-pack reconciled to distilled layer."
}
