{
  "schema_version": "source-metadata-v1",
  "source_id": "new-rules-of-context-8bacf4e1",
  "title": "new-rules-of-context-engineering-claude-5",
  "author": null,
  "year": null,
  "source_type": "markdown",
  "file_type": "md",
  "original_filename": "source.md",
  "original_url": null,
  "sha256": "8bacf4e1ca9cb0bf3087cc774bed01b180e1f019c66abfc0e1cec8587fba35f1",
  "file_size_bytes": 10472,
  "authority": "secondary",
  "rights_status": "distillation-only",
  "volatility": "low",
  "review_cadence": "annual",
  "conversion_status": "ok",
  "converter_used": null,
  "converter_warnings": [],
  "page_count": null,
  "word_count": 1582,
  "anchor_count": 1,
  "asset_count": null,
  "ingested_at": "2026-07-25T09:58:36.156827+00:00",
  "notes": null
}