{
  "schema_version": "source-metadata-v1",
  "source_id": "dynamic-formal-equiv-e6872198",
  "title": "dynamic-formal-equivalence-nida1964",
  "author": null,
  "year": null,
  "source_type": "markdown",
  "file_type": "md",
  "original_filename": "source.md",
  "original_url": null,
  "sha256": "e6872198422504a2952d709f0713ba7c3d17990f700d0a954e535b3d26504065",
  "file_size_bytes": 65802,
  "authority": "secondary",
  "rights_status": "distillation-only",
  "volatility": "low",
  "review_cadence": "annual",
  "conversion_status": "ok",
  "converter_used": null,
  "converter_warnings": [],
  "page_count": null,
  "word_count": 10406,
  "anchor_count": 3,
  "asset_count": null,
  "ingested_at": "2026-07-13T10:14:01.478950+00:00",
  "notes": null
}
