{
  "schema_version": "source-metadata-v1",
  "source_id": "escaping-the-build-t-37d2b8d9",
  "title": "escaping-the-build-trap-perri",
  "author": null,
  "year": null,
  "source_type": "markdown",
  "file_type": "md",
  "original_filename": "source.md",
  "original_url": null,
  "sha256": "37d2b8d97a65e6850049c3d801d00d356293d1c3e7d16d2a3b5a71547d2c0462",
  "file_size_bytes": 368835,
  "authority": "secondary",
  "rights_status": "distillation-only",
  "volatility": "low",
  "review_cadence": "annual",
  "conversion_status": "ok",
  "converter_used": null,
  "converter_warnings": [],
  "page_count": null,
  "word_count": 58613,
  "anchor_count": 13,
  "asset_count": null,
  "ingested_at": "2026-07-02T22:52:37.961514+00:00",
  "notes": null
}
