{
  "schema_version": "source-metadata-v1",
  "source_id": "docs-like-code-stori-9b3c3a53",
  "title": "docs-like-code-stories",
  "author": null,
  "year": null,
  "source_type": "markdown",
  "file_type": "markdown",
  "original_filename": "original.md",
  "original_url": null,
  "sha256": "9b3c3a535ed6613c2036dd72353f87be958bc857a9d0d240c50be3d8ed92beec",
  "file_size_bytes": 60879,
  "authority": "secondary",
  "rights_status": "distillation-only",
  "volatility": "low",
  "review_cadence": "annual",
  "conversion_status": "ok",
  "converter_used": "passthrough",
  "converter_warnings": [],
  "page_count": null,
  "word_count": null,
  "anchor_count": 112,
  "asset_count": 0,
  "ingested_at": "2026-06-27T14:45:50.174259+00:00",
  "notes": null
}