{
  "schema_version": "source-metadata-v1",
  "source_id": "xueshu-yanjiu-chengg-ff70b27e",
  "title": "xueshu-yanjiu-chenggong-zhidao",
  "author": null,
  "year": null,
  "source_type": "markdown",
  "file_type": "md",
  "original_filename": "source.md",
  "original_url": null,
  "sha256": "ff70b27e8bcd27747ed7fcc43e4680441125fff8bd28796fb95200e33be75f72",
  "file_size_bytes": 403588,
  "authority": "secondary",
  "rights_status": "distillation-only",
  "volatility": "low",
  "review_cadence": "annual",
  "conversion_status": "ok",
  "converter_used": null,
  "converter_warnings": [],
  "page_count": null,
  "word_count": 6360,
  "anchor_count": 5,
  "asset_count": null,
  "ingested_at": "2026-07-24T22:10:59.773685+00:00",
  "notes": null
}
