{
  "schema_version": "source-metadata-v1",
  "source_id": "information-architec-861e11e3",
  "title": "information-architecture-4e",
  "author": null,
  "year": null,
  "source_type": "markdown",
  "file_type": "md",
  "original_filename": "source.md",
  "original_url": null,
  "sha256": "861e11e30d6eaf924d59772226d036313dbde6ff6fa13506f2fec3fdc8b649f5",
  "file_size_bytes": 773987,
  "authority": "secondary",
  "rights_status": "distillation-only",
  "volatility": "low",
  "review_cadence": "annual",
  "conversion_status": "ok",
  "converter_used": null,
  "converter_warnings": [],
  "page_count": null,
  "word_count": 110495,
  "anchor_count": 26,
  "asset_count": null,
  "ingested_at": "2026-07-03T00:54:33.118629+00:00",
  "notes": null
}
