{
  "schema_version": "source-metadata-v1",
  "source_id": "norms-in-translation-ad249b8d",
  "title": "norms-in-translation-toury",
  "author": null,
  "year": null,
  "source_type": "markdown",
  "file_type": "md",
  "original_filename": "source.md",
  "original_url": null,
  "sha256": "ad249b8df9d0b920f6e22763ab18a653ea9a8ed97aa2bbb809d6b178970f536d",
  "file_size_bytes": 44274,
  "authority": "secondary",
  "rights_status": "distillation-only",
  "volatility": "low",
  "review_cadence": "annual",
  "conversion_status": "ok",
  "converter_used": null,
  "converter_warnings": [],
  "page_count": null,
  "word_count": 6836,
  "anchor_count": 2,
  "asset_count": null,
  "ingested_at": "2026-07-13T10:14:01.479666+00:00",
  "notes": null
}
