{
  "schema_version": "source-metadata-v1",
  "source_id": "harness-mcp-server-r-eed3b927",
  "title": "harness-mcp-server-redesign",
  "author": null,
  "year": null,
  "source_type": "markdown",
  "file_type": "markdown",
  "original_filename": "source.md",
  "original_url": null,
  "sha256": "eed3b927f9233065be06061b31cb55d35c8affc1b7f4789085dfcee1c37f2da4",
  "file_size_bytes": 29227,
  "authority": "secondary",
  "rights_status": "distillation-only",
  "volatility": "low",
  "review_cadence": "annual",
  "conversion_status": "ok",
  "converter_used": null,
  "converter_warnings": [],
  "page_count": null,
  "word_count": 3738,
  "anchor_count": 1,
  "asset_count": null,
  "ingested_at": "2026-07-05T07:21:29.911044+00:00",
  "notes": null
}
