{
  "schema_version": "source-metadata-v1",
  "source_id": "chinglish-europeaniz-5798beb7",
  "title": "chinglish-europeanized-chinese-yu",
  "author": null,
  "year": null,
  "source_type": "markdown",
  "file_type": "md",
  "original_filename": "source.md",
  "original_url": null,
  "sha256": "5798beb748a0cb78314cb69afbab99a4a731b5ae4dd2b69df37a5a038fc461a1",
  "file_size_bytes": 31419,
  "authority": "secondary",
  "rights_status": "distillation-only",
  "volatility": "low",
  "review_cadence": "annual",
  "conversion_status": "ok",
  "converter_used": null,
  "converter_warnings": [],
  "page_count": null,
  "word_count": 403,
  "anchor_count": 1,
  "asset_count": null,
  "ingested_at": "2026-07-11T12:54:14.697418+00:00",
  "notes": null
}
