{
  "schema_version": "source-metadata-v1",
  "source_id": "scalable-architectur-705fce79",
  "title": "Original",
  "author": null,
  "year": null,
  "source_type": "markdown",
  "file_type": "markdown",
  "original_filename": "original.md",
  "original_url": null,
  "sha256": "705fce793a41d366d17cf4253f0b739372c457bc8c7b27c922cc060c95c1b5d2",
  "file_size_bytes": 741072,
  "authority": "secondary",
  "rights_status": "distillation-only",
  "volatility": "low",
  "review_cadence": "annual",
  "conversion_status": "ok",
  "converter_used": "cache",
  "converter_warnings": [],
  "page_count": null,
  "word_count": null,
  "anchor_count": 226,
  "asset_count": 0,
  "ingested_at": "2026-06-20T04:40:45.380844+00:00",
  "notes": null
}