{
  "schema_version": "source-metadata-v1",
  "source_id": "xunit-test-patterns-11f28a21",
  "title": "xunit-test-patterns-meszaros",
  "author": null,
  "year": null,
  "source_type": "markdown",
  "file_type": "markdown",
  "original_filename": "source.md",
  "original_url": null,
  "sha256": "11f28a2119c700bce5d07ee570471a9e118cfcb8dda4147091a4c226eb2e2728",
  "file_size_bytes": 1807508,
  "authority": "secondary",
  "rights_status": "distillation-only",
  "volatility": "low",
  "review_cadence": "annual",
  "conversion_status": "ok",
  "converter_used": null,
  "converter_warnings": [],
  "page_count": null,
  "word_count": 278652,
  "anchor_count": 59,
  "asset_count": null,
  "ingested_at": "2026-07-03T13:16:35.057191+00:00",
  "notes": null
}