{
  "schema_version": "source-metadata-v1",
  "source_id": "darby-lang-small-tea-84140e5a",
  "title": "darby-lang-small-teaching-online",
  "author": null,
  "year": null,
  "source_type": "markdown",
  "file_type": "md",
  "original_filename": "source.md",
  "original_url": null,
  "sha256": "84140e5a34424e2fb7f6e149d47df397529f2834785026a6921912f2d31b9562",
  "file_size_bytes": 497286,
  "authority": "secondary",
  "rights_status": "distillation-only",
  "volatility": "low",
  "review_cadence": "annual",
  "conversion_status": "ok",
  "converter_used": null,
  "converter_warnings": [],
  "page_count": null,
  "word_count": 79573,
  "anchor_count": 17,
  "asset_count": null,
  "ingested_at": "2026-07-26T10:28:14.933302+00:00",
  "notes": null
}
