{
  "schema_version": "source-metadata-v1",
  "source_id": "how-to-take-smart-no-a0f38246",
  "title": "how-to-take-smart-notes",
  "author": null,
  "year": null,
  "source_type": "markdown",
  "file_type": "md",
  "original_filename": "source.md",
  "original_url": null,
  "sha256": "a0f38246af25dc2e46bf568afb0141b0208f2796086dcdde7b527c10b72f5392",
  "file_size_bytes": 349116,
  "authority": "secondary",
  "rights_status": "distillation-only",
  "volatility": "low",
  "review_cadence": "annual",
  "conversion_status": "ok",
  "converter_used": null,
  "converter_warnings": [],
  "page_count": null,
  "word_count": 56822,
  "anchor_count": 15,
  "asset_count": null,
  "ingested_at": "2026-07-24T22:10:59.268458+00:00",
  "notes": null
}
