{
  "schema_version": "source-metadata-v1",
  "source_id": "parecki-mcp-auth-nov-c8cf335b",
  "title": "parecki-mcp-auth-nov2025-spec",
  "author": null,
  "year": null,
  "source_type": "markdown",
  "file_type": "md",
  "original_filename": "source.md",
  "original_url": null,
  "sha256": "c8cf335ba0d6cc765d34357174df5179b30741eb097db63e7b725db6bc2a59d7",
  "file_size_bytes": 9919,
  "authority": "secondary",
  "rights_status": "distillation-only",
  "volatility": "low",
  "review_cadence": "annual",
  "conversion_status": "ok",
  "converter_used": null,
  "converter_warnings": [],
  "page_count": null,
  "word_count": 1437,
  "anchor_count": 1,
  "asset_count": null,
  "ingested_at": "2026-07-05T07:23:29.968854+00:00",
  "notes": null
}